{
  "$schema": "./catalog.schema.json",
  "schemaVersion": 1,
  "instructionMode": "embedded",
  "package": {
    "name": "qodo",
    "displayName": "Qodo for coding agents",
    "version": "2.0.13",
    "description": "Qodo code intelligence, review, and organizational standards for local coding agents.",
    "repository": "https://github.com/qodo-ai/qodo-skills",
    "homepage": "https://www.qodo.ai",
    "supportUrl": "https://help.qodo.ai/hc/en-us/requests/new",
    "privacyPolicyUrl": "https://www.qodo.ai/privacy-policy/",
    "termsOfServiceUrl": "https://www.qodo.ai/terms/",
    "license": "MIT",
    "brandColor": "#6D4AFF"
  },
  "runtime": {
    "command": "qodo",
    "readCommand": "qodo read",
    "loginCommand": "qodo login",
    "protocolVersion": 2,
    "minimumCliVersion": "0.1.0-next.37"
  },
  "installPackages": [
    {
      "name": "qodo",
      "displayName": "Qodo",
      "description": "Qodo setup, code intelligence, and review workflows.",
      "antigravity": {
        "description": "Set up Qodo, explore code and repository history, review local changes, and resolve pull-request findings directly from Antigravity.",
        "suggestedPrompts": [
          "Connect my Qodo account and verify this coding agent is ready.",
          "Explain how this code works, including its history and cross-repository impact.",
          "Review my local changes with Qodo before I push them."
        ]
      },
      "default": true,
      "skills": [
        "qodo-setup",
        "qodo-codebase-wisdom",
        "qodo-review",
        "qodo-review-resolver",
        "qodo-pr-triage"
      ],
      "compatibilityAliases": {
        "codebase-wisdom": "qodo-codebase-wisdom",
        "pre-pr-review": "qodo-review",
        "resolve-findings": "qodo-review-resolver"
      }
    },
    {
      "name": "qodo-standards",
      "displayName": "Qodo Standards",
      "description": "Optional Qodo rules discovery and standards administration workflows.",
      "antigravity": {
        "description": "Find the Qodo coding standards relevant to your work, then create, update, scope, and triage review rules directly from Antigravity.",
        "suggestedPrompts": [
          "Load the Qodo coding standards relevant to this task.",
          "Capture this convention as a Qodo Review standard."
        ]
      },
      "default": false,
      "skills": [
        "qodo-get-rules",
        "qodo-manage-standards"
      ],
      "compatibilityAliases": {
        "get-rules": "qodo-get-rules",
        "qodo-manage-rules": "qodo-manage-standards"
      }
    }
  ],
  "skills": [
    {
      "name": "qodo-setup",
      "version": "1.0.9",
      "recommended": true,
      "displayName": "Set up Qodo",
      "shortDescription": "Connect the Qodo runtime and verify this agent is ready.",
      "defaultPrompt": "Use $qodo-setup to connect my Qodo account and verify this coding agent."
    },
    {
      "name": "qodo-codebase-wisdom",
      "version": "1.1.5",
      "recommended": true,
      "displayName": "Qodo Codebase Wisdom",
      "shortDescription": "Understand code, history, and cross-repo impact.",
      "defaultPrompt": "Use $qodo-codebase-wisdom to explain how this code works and cite the evidence."
    },
    {
      "name": "qodo-get-rules",
      "version": "1.1.5",
      "recommended": false,
      "displayName": "Qodo Rules",
      "shortDescription": "Load the standards that apply to the current change.",
      "defaultPrompt": "Use $qodo-get-rules to load the Qodo standards relevant to this task."
    },
    {
      "name": "qodo-manage-standards",
      "version": "1.0.5",
      "recommended": false,
      "displayName": "Qodo Standards Manager",
      "shortDescription": "Create and maintain Qodo Review Standards.",
      "defaultPrompt": "Use $qodo-manage-standards to capture this convention as a Qodo standard."
    },
    {
      "name": "qodo-review",
      "version": "1.10.7",
      "recommended": true,
      "displayName": "Qodo Local Review",
      "shortDescription": "Review coding milestones and local changes before handoff.",
      "defaultPrompt": "Use $qodo-review to review my local changes before I push them."
    },
    {
      "name": "qodo-review-resolver",
      "version": "1.4.7",
      "recommended": true,
      "displayName": "Qodo Review Resolver",
      "shortDescription": "Read, audit and resolve Qodo PR findings with citation evidence.",
      "defaultPrompt": "Use $qodo-review-resolver to show me the current Qodo review findings."
    },
    {
      "name": "qodo-pr-triage",
      "version": "0.1.0",
      "recommended": true,
      "displayName": "Qodo PR Triage",
      "shortDescription": "See what's next in your ranked PR queue and act on it.",
      "defaultPrompt": "Use $qodo-pr-triage to show me what's next in my PR queue."
    }
  ]
}
